# streamdiff report: A-only/B-only packets

Capture A: TC-001-1-20160407-A.pcap (stream 0)
Capture B: TC-001-1-20160407-B.pcap (stream 0)


```text
Summary:
  Packets in A: 3
  Packets in B: 3
  A-only packets (by IP ID): 0
  B-only packets (by IP ID): 0

No A-only or B-only packets detected.
```


======================================================================================================================================================
Connection: TC-001-1-20160407-A.pcap(stream=0) vs TC-001-1-20160407-B.pcap(stream=0)
======================================================================================================================================================
Time       IPID     | Capture A Flow                                                                   | Capture B Flow                                                                   | Status         
------------------------------------------------------------------------------------------------------------------------------------------------------------------------------------------------------------------
0.000000   0xbd6c   |                                                                                  | --> 43335 → 6096 [SYN] Seq=3621033337 Win=65535 Len=0 MSS=1448   3621033337/0    | ONLY_IN_B      
0.001045   0x0000   |                                                                                  | <-- 6096 → 43335 [SYN, ACK] Seq=4121236513 Ack=3621033338 Win=58 4121236513/3621033338 | ONLY_IN_B      
2.653136   0xbda5   |                                                                                  | --> [TCP Retransmission] 43335 → 6096 [SYN] Seq=3621033337 Win=6 3621033337/0    | ONLY_IN_B      
5920.838756 0x7a13   | --> 53039 → 6096 [SYN] Seq=3497667243 Win=65535 Len=0 MSS=1460   3497667243/0    |                                                                                  | ONLY_IN_A      
5923.481754 0x7a52   | --> [TCP Retransmission] 53039 → 6096 [SYN] Seq=3497667243 Win=6 3497667243/0    |                                                                                  | ONLY_IN_A      
5929.499879 0x7aae   | --> [TCP Retransmission] 53039 → 6096 [SYN] Seq=3497667243 Win=6 3497667243/0    |                                                                                  | ONLY_IN_A      

==================================================================================================================================================================================================================
Summary: TC-001-1-20160407-A.pcap(stream=0) vs TC-001-1-20160407-B.pcap(stream=0): 6 differences (ipid=6) in 3/3 packets
==================================================================================================================================================================================================================
